{
  "schemaVersion": 1,
  "catalogId": "pd2-inspiration-bkvince",
  "status": "study",
  "source": {
    "repository": "https://github.com/Lukaszpg/PD2-Single-Player-Plus-mod",
    "commit": "3debc6781f33c3c1474a995b80369a4e618cd386",
    "tree": "6f51e17e5f65abdd50b2fd33190c571fef296ccf",
    "repositoryFileCount": 198,
    "tableCount": 93,
    "tableManifestSha256": "AED5AC542E7B879FBF6BEB49F7F76A8ED40F5725DC830E82536CBA2A1C44A2B8",
    "checkedAt": "2026-08-08"
  },
  "wikiRevisions": [
    {
      "title": "General Changes",
      "url": "https://wiki.projectdiablo2.com/wiki/General_Changes",
      "revision": 23441,
      "timestamp": "2026-05-25T15:18:03Z"
    },
    {
      "title": "Game Mechanics",
      "url": "https://wiki.projectdiablo2.com/wiki/Game_Mechanics",
      "revision": 23934,
      "timestamp": "2026-07-18T16:30:25Z"
    },
    {
      "title": "Skill Changes",
      "url": "https://wiki.projectdiablo2.com/wiki/Skill_Changes",
      "revision": 23785,
      "timestamp": "2026-06-17T00:20:40Z"
    },
    {
      "title": "Mercenaries",
      "url": "https://wiki.projectdiablo2.com/wiki/Mercenaries",
      "revision": 22882,
      "timestamp": "2026-05-03T02:38:18Z"
    },
    {
      "title": "Mercenary Skills",
      "url": "https://wiki.projectdiablo2.com/wiki/Mercenary_Skills",
      "revision": 23765,
      "timestamp": "2026-06-12T18:34:25Z"
    },
    {
      "title": "Monsters",
      "url": "https://wiki.projectdiablo2.com/wiki/Monsters",
      "revision": 23935,
      "timestamp": "2026-07-20T23:33:41Z"
    },
    {
      "title": "Item Bases",
      "url": "https://wiki.projectdiablo2.com/wiki/Item_Bases",
      "revision": 23075,
      "timestamp": "2026-05-11T01:40:58Z"
    },
    {
      "title": "Item Affixes",
      "url": "https://wiki.projectdiablo2.com/wiki/Item_Affixes",
      "revision": 23938,
      "timestamp": "2026-07-26T11:49:54Z"
    }
  ],
  "method": {
    "sourceLayers": ["pd2_core", "single_player_plus", "unknown"],
    "target": "BKVince D2RLoader 3.2 build 92777",
    "excluded": ["PvP balance", "online-only ladder and trade infrastructure", "asset comparison in the first report"],
    "savePolicy": "Preserve existing BKVince characters and stashes whenever possible; stop for an explicit decision before an unavoidable reset.",
    "multiplayerPolicy": "Validate solo first; host/joiner remains mandatory before a lot is fully delivered.",
    "sequence": "Complete the governed audit before opening stable implementation lots.",
    "implementationBoundary": "This catalog records evidence and candidate dispositions only; it does not authorize bulk copying or gameplay table changes."
  },
  "coverage": {
    "pd2Tables": [
      "aiparms.txt", "arena.txt", "armor.txt", "armtype.txt", "automagic.txt", "automap.txt", "belts.txt", "bodylocs.txt", "books.txt", "charstats.txt", "chartemplate.txt", "colors.txt", "compcode.txt", "composit.txt", "cubemain.txt", "cubemod.txt", "cubetype.txt", "difficultylevels.txt", "elemtypes.txt", "events.txt", "experience.txt", "gamble.txt", "gems.txt", "hiredesc.txt", "hireling.txt", "hitclass.txt", "inventory.txt", "itemratio.txt", "itemstatcost.txt", "itemtypes.txt", "levels.txt", "lowqualityitems.txt", "lvlmaze.txt", "lvlprest.txt", "lvlsub.txt", "lvltypes.txt", "lvlwarp.txt", "magicprefix.txt", "magicsuffix.txt", "miniskillicons.txt", "misc.txt", "misscalc.txt", "missiles.txt", "monai.txt", "monequip.txt", "monitempercent.txt", "monlvl.txt", "monmode.txt", "monname.txt", "monplace.txt", "monpreset.txt", "monprop.txt", "monseq.txt", "monsounds.txt", "monstats.txt", "monstats2.txt", "montype.txt", "monumod.txt", "npc.txt", "objects.txt", "objgroup.txt", "objmode.txt", "objtype.txt", "overlay.txt", "pettype.txt", "playerclass.txt", "plrmode.txt", "plrtype.txt", "properties.txt", "qualityitems.txt", "rareprefix.txt", "raresuffix.txt", "runes.txt", "setitems.txt", "sets.txt", "shrines.txt", "skillcalc.txt", "skilldesc.txt", "skills.txt", "soundenviron.txt", "sounds.txt", "states.txt", "storepage.txt", "superuniques.txt", "treasureclass.txt", "treasureclassex.txt", "uniqueappellation.txt", "uniqueitems.txt", "uniqueprefix.txt", "uniquesuffix.txt", "uniquetitle.txt", "weaponclass.txt", "weapons.txt"
    ],
    "pd2RoundTripByteExact": true,
    "pd2Eol": "LF",
    "bkvinceTableCount": 50,
    "commonTables": 49,
    "exactNormalizedHeaders": 9,
    "schemaDifferences": 40,
    "pd2OnlyCount": 44,
    "bkvinceOnly": ["levelgroups.txt"]
  },
  "credits": [
    {
      "name": "Project Diablo 2 Team",
      "role": "Original PD2 design and data source",
      "source": "https://www.projectdiablo2.com/"
    },
    {
      "name": "Lukaszpg",
      "role": "Single Player Plus adaptation and repository",
      "source": "https://github.com/Lukaszpg/PD2-Single-Player-Plus-mod"
    },
    {
      "name": "RuffnecKk",
      "role": "BKVince analysis, adaptation, and validation",
      "source": "Workspace RuffnecKk"
    }
  ],
  "chapters": [
    { "id": "inventory", "title": "Table inventory and structural comparison", "status": "complete" },
    { "id": "mechanics-foundation", "title": "Game Mechanics foundation and engine contracts", "status": "complete" },
    { "id": "general-qol", "title": "General changes, quality of life, and balance", "status": "in_progress" },
    { "id": "mercenaries", "title": "Mercenaries, equipment, skills, and AI", "status": "planned" },
    { "id": "skills", "title": "Global and class-specific skills", "status": "planned" },
    { "id": "monsters-bosses", "title": "Monsters and bosses", "status": "planned" },
    { "id": "items", "title": "Item bases, affixes, crafting, and concepts", "status": "planned" },
    { "id": "single-player-plus", "title": "Single Player Plus overlay", "status": "planned" },
    { "id": "hardcoded", "title": "Hardcoded behavior, AI, pointmods, and native routes", "status": "planned" }
  ],
  "entries": [
    {
      "id": "storage-layout",
      "title": "Expanded storage and inventory layout",
      "domain": "general_qol",
      "sourceLayer": "mixed",
      "sourceRefs": ["General Changes", "inventory.txt", "misc.txt"],
      "tables": ["inventory.txt", "misc.txt"],
      "playerEffect": "Expands practical storage and inventory usability.",
      "bkvinceCoverage": "better",
      "route": "none",
      "disposition": "keep_bkvince",
      "evidenceStatus": "verified",
      "saveRisk": "none",
      "multiplayer": "not_applicable",
      "rationale": "BKVince already has its own larger storage and charm-inventory identity; PD2 parity would regress or conflict.",
      "dependencies": []
    },
    {
      "id": "stackable-materials",
      "title": "Stackable materials and consumables",
      "domain": "general_qol",
      "sourceLayer": "mixed",
      "sourceRefs": ["General Changes", "misc.txt", "itemtypes.txt", "cubemain.txt"],
      "tables": ["misc.txt", "itemtypes.txt", "cubemain.txt"],
      "playerEffect": "Reduces stash friction by stacking common progression materials.",
      "bkvinceCoverage": "equivalent",
      "route": "none",
      "disposition": "keep_bkvince",
      "evidenceStatus": "verified",
      "saveRisk": "none",
      "multiplayer": "not_applicable",
      "rationale": "The concept is already present in BKVince and should be compared for missing cases rather than copied wholesale.",
      "dependencies": []
    },
    {
      "id": "players-five-nodrop",
      "title": "PD2 core solo NoDrop baseline",
      "domain": "balance",
      "sourceLayer": "pd2_core",
      "sourceRefs": ["Game Mechanics", "treasureclassex.txt"],
      "tables": ["treasureclassex.txt"],
      "playerEffect": "Raises solo drop quantity through PD2 Treasure Class weights without increasing monster difficulty.",
      "bkvinceCoverage": "conflict",
      "route": "data_only",
      "disposition": "adapt_retune",
      "evidenceStatus": "verified",
      "saveRisk": "none",
      "multiplayer": "host_authority_required",
      "rationale": "The official page attributes the p5-like solo baseline to PD2 core, and the two published NoDrop examples reproduce exactly from the PD2 table weights while BKVince reproduces the LoD values. Adaptation is data-only but still requires a complete BKVince economy baseline and statistical validation.",
      "dependencies": []
    },
    {
      "id": "endgame-zone-levels",
      "title": "High-level and corrupted-zone progression",
      "domain": "world",
      "sourceLayer": "pd2_core",
      "sourceRefs": ["General Changes", "levels.txt", "monstats.txt", "treasureclassex.txt"],
      "tables": ["levels.txt", "monstats.txt", "treasureclassex.txt"],
      "playerEffect": "Broadens viable endgame farming areas and reward bands.",
      "bkvinceCoverage": "partial",
      "route": "hybrid",
      "disposition": "adapt_retune",
      "evidenceStatus": "partial",
      "saveRisk": "low",
      "multiplayer": "host_authority_required",
      "rationale": "BKVince already has rifts, terror-zone work, and corruptions, so PD2 zone concepts need integration into that ecosystem.",
      "dependencies": ["rift-terror-zone-group"]
    },
    {
      "id": "pointmods-overhaul",
      "title": "Class skill pointmods and staffmods",
      "domain": "item",
      "sourceLayer": "pd2_core",
      "sourceRefs": ["Skill Changes", "skills.txt", "weapons.txt", "armor.txt", "misc.txt", "itemstatcost.txt"],
      "tables": ["skills.txt", "weapons.txt", "armor.txt", "misc.txt", "itemstatcost.txt"],
      "playerEffect": "Changes which class skills can naturally roll on class-specific equipment.",
      "bkvinceCoverage": "partial",
      "route": "unknown",
      "disposition": "needs_re",
      "evidenceStatus": "partial",
      "saveRisk": "medium",
      "multiplayer": "host_authority_required",
      "rationale": "D2R 3.2 staffmod generation may combine table rules with native logic; the active BKVince staffmod test must settle the route.",